{
  "artifact_id": "MATH-001-ESTIMAND-REGISTRY",
  "schema_version": "1.1.0",
  "as_of": "2026-08-02",
  "input_states": [
    "symbolic",
    "measured",
    "unknown",
    "human_authoritative"
  ],
  "inputs": [
    {
      "input_id": "baseline_f9_rate",
      "symbol": "p0",
      "state": "unknown",
      "information_class": "ACCESS_DEPENDENT",
      "unit": "bookings_per_route_day",
      "value": null,
      "owner": "authorized firm outcome-data custodian",
      "gate_id": "GATE-OUTCOME-LABELS-MATURITY-001",
      "proof_level": 0,
      "measurement": null,
      "authority_attestation": null,
      "sensitivity_set_ids": []
    },
    {
      "input_id": "baseline_f9_variance",
      "symbol": "sigma2",
      "state": "unknown",
      "information_class": "ACCESS_DEPENDENT",
      "unit": "bookings_squared_per_route_day",
      "value": null,
      "owner": "authorized firm outcome-data custodian",
      "gate_id": "GATE-OUTCOME-LABELS-MATURITY-001",
      "proof_level": 0,
      "measurement": null,
      "authority_attestation": null,
      "sensitivity_set_ids": []
    },
    {
      "input_id": "incremental_f9_effect",
      "symbol": "tau",
      "state": "unknown",
      "information_class": "EMPIRICAL_ONLY",
      "unit": "bookings_per_route_day",
      "value": null,
      "owner": "randomized experiment and outcome custodian",
      "gate_id": "GATE-FULL-EXTERNAL-EVIDENCE-001",
      "proof_level": 0,
      "measurement": null,
      "authority_attestation": null,
      "sensitivity_set_ids": []
    },
    {
      "input_id": "predictive_f9_risk",
      "symbol": "p_f9",
      "state": "unknown",
      "information_class": "EMPIRICAL_ONLY",
      "unit": "probability",
      "value": null,
      "owner": "historical point-in-time model and outcome custodian",
      "gate_id": "GATE-FULL-EXTERNAL-EVIDENCE-001",
      "proof_level": 0,
      "measurement": null,
      "authority_attestation": null,
      "sensitivity_set_ids": []
    },
    {
      "input_id": "f9_maturity_horizon_days",
      "symbol": "W",
      "state": "human_authoritative",
      "information_class": "HUMAN_AUTHORITATIVE",
      "unit": "days",
      "value": null,
      "owner": "authorized outcome-policy owner",
      "gate_id": "GATE-OUTCOME-LABELS-MATURITY-001",
      "proof_level": 0,
      "measurement": null,
      "authority_attestation": null,
      "sensitivity_set_ids": []
    },
    {
      "input_id": "candidate_incremental_effect",
      "symbol": "delta_i",
      "state": "unknown",
      "information_class": "EMPIRICAL_ONLY",
      "unit": "incremental_bookings_per_candidate",
      "value": null,
      "owner": "randomized experiment and outcome custodian",
      "gate_id": "GATE-FULL-EXTERNAL-EVIDENCE-001",
      "proof_level": 0,
      "measurement": null,
      "authority_attestation": null,
      "sensitivity_set_ids": []
    },
    {
      "input_id": "attendance_probability",
      "symbol": "p_attend",
      "state": "unknown",
      "information_class": "EMPIRICAL_ONLY",
      "unit": "probability",
      "value": null,
      "owner": "authorized mature-funnel outcome custodian",
      "gate_id": "GATE-FULL-EXTERNAL-EVIDENCE-001",
      "proof_level": 0,
      "measurement": null,
      "authority_attestation": null,
      "sensitivity_set_ids": []
    },
    {
      "input_id": "mandate_probability",
      "symbol": "p_mandate",
      "state": "unknown",
      "information_class": "EMPIRICAL_ONLY",
      "unit": "probability",
      "value": null,
      "owner": "authorized mature-funnel outcome custodian",
      "gate_id": "GATE-FULL-EXTERNAL-EVIDENCE-001",
      "proof_level": 0,
      "measurement": null,
      "authority_attestation": null,
      "sensitivity_set_ids": []
    },
    {
      "input_id": "transaction_probability",
      "symbol": "p_transaction",
      "state": "unknown",
      "information_class": "EMPIRICAL_ONLY",
      "unit": "probability",
      "value": null,
      "owner": "authorized mature-funnel outcome custodian",
      "gate_id": "GATE-FULL-EXTERNAL-EVIDENCE-001",
      "proof_level": 0,
      "measurement": null,
      "authority_attestation": null,
      "sensitivity_set_ids": []
    },
    {
      "input_id": "expected_commission",
      "symbol": "commission",
      "state": "unknown",
      "information_class": "ACCESS_DEPENDENT",
      "unit": "currency_per_transaction",
      "value": null,
      "owner": "authorized finance and outcome custodian",
      "gate_id": "GATE-FULL-EXTERNAL-EVIDENCE-001",
      "proof_level": 0,
      "measurement": null,
      "authority_attestation": null,
      "sensitivity_set_ids": []
    },
    {
      "input_id": "incremental_operational_cost",
      "symbol": "cost",
      "state": "unknown",
      "information_class": "ACCESS_DEPENDENT",
      "unit": "currency_per_candidate",
      "value": null,
      "owner": "authorized finance and operations custodian",
      "gate_id": "firm_economics_services_territories",
      "proof_level": 0,
      "measurement": null,
      "authority_attestation": null,
      "sensitivity_set_ids": []
    },
    {
      "input_id": "risk_uncertainty_penalty",
      "symbol": "risk",
      "state": "unknown",
      "information_class": "EMPIRICAL_ONLY",
      "unit": "currency_per_candidate",
      "value": null,
      "owner": "authorized risk and outcome custodian",
      "gate_id": "GATE-FULL-EXTERNAL-EVIDENCE-001",
      "proof_level": 0,
      "measurement": null,
      "authority_attestation": null,
      "sensitivity_set_ids": []
    },
    {
      "input_id": "risk_aversion_policy",
      "symbol": "lambda",
      "state": "human_authoritative",
      "information_class": "HUMAN_AUTHORITATIVE",
      "unit": "dimensionless_utility_weight",
      "value": null,
      "owner": "authorized firm decision-maker",
      "gate_id": "firm_economics_services_territories",
      "proof_level": 0,
      "measurement": null,
      "authority_attestation": null,
      "sensitivity_set_ids": []
    },
    {
      "input_id": "minimum_meaningful_absolute_lift",
      "symbol": "Delta",
      "state": "human_authoritative",
      "information_class": "HUMAN_AUTHORITATIVE",
      "unit": "bookings_per_route_day",
      "value": null,
      "owner": "authorized firm decision-maker",
      "gate_id": "firm_economics_services_territories",
      "proof_level": 0,
      "measurement": null,
      "authority_attestation": null,
      "sensitivity_set_ids": []
    },
    {
      "input_id": "alpha",
      "symbol": "alpha",
      "state": "human_authoritative",
      "information_class": "HUMAN_AUTHORITATIVE",
      "unit": "probability",
      "value": null,
      "owner": "authorized experimental protocol owner",
      "gate_id": "GATE-EXPERIMENT-PROTOCOL-001",
      "proof_level": 0,
      "measurement": null,
      "authority_attestation": null,
      "sensitivity_set_ids": []
    },
    {
      "input_id": "target_power",
      "symbol": "one_minus_beta",
      "state": "human_authoritative",
      "information_class": "HUMAN_AUTHORITATIVE",
      "unit": "probability",
      "value": null,
      "owner": "authorized experimental protocol owner",
      "gate_id": "GATE-EXPERIMENT-PROTOCOL-001",
      "proof_level": 0,
      "measurement": null,
      "authority_attestation": null,
      "sensitivity_set_ids": []
    },
    {
      "input_id": "allocation_ratio",
      "symbol": "rho",
      "state": "human_authoritative",
      "information_class": "HUMAN_AUTHORITATIVE",
      "unit": "ratio",
      "value": null,
      "owner": "authorized experimental protocol owner",
      "gate_id": "GATE-EXPERIMENT-PROTOCOL-001",
      "proof_level": 0,
      "measurement": null,
      "authority_attestation": null,
      "sensitivity_set_ids": []
    },
    {
      "input_id": "route_day_cluster_size",
      "symbol": "m",
      "state": "unknown",
      "information_class": "EMPIRICAL_ONLY",
      "unit": "route_days_per_cluster",
      "value": null,
      "owner": "field instrumentation and outcome custodian",
      "gate_id": "GATE-OUTCOME-LABELS-MATURITY-001",
      "proof_level": 0,
      "measurement": null,
      "authority_attestation": null,
      "sensitivity_set_ids": []
    },
    {
      "input_id": "intracluster_correlation",
      "symbol": "icc",
      "state": "unknown",
      "information_class": "EMPIRICAL_ONLY",
      "unit": "correlation",
      "value": null,
      "owner": "field instrumentation and outcome custodian",
      "gate_id": "GATE-OUTCOME-LABELS-MATURITY-001",
      "proof_level": 0,
      "measurement": null,
      "authority_attestation": null,
      "sensitivity_set_ids": []
    },
    {
      "input_id": "interference_structure",
      "symbol": "I",
      "state": "unknown",
      "information_class": "EMPIRICAL_ONLY",
      "unit": "registered_radius_or_exposure",
      "value": null,
      "owner": "field instrumentation and outcome custodian",
      "gate_id": "GATE-OUTCOME-LABELS-MATURITY-001",
      "proof_level": 0,
      "measurement": null,
      "authority_attestation": null,
      "sensitivity_set_ids": []
    },
    {
      "input_id": "adherence_rate",
      "symbol": "adh",
      "state": "unknown",
      "information_class": "EMPIRICAL_ONLY",
      "unit": "proportion",
      "value": null,
      "owner": "field instrumentation and outcome custodian",
      "gate_id": "GATE-OUTCOME-LABELS-MATURITY-001",
      "proof_level": 0,
      "measurement": null,
      "authority_attestation": null,
      "sensitivity_set_ids": []
    },
    {
      "input_id": "substitution_rate",
      "symbol": "sub",
      "state": "unknown",
      "information_class": "EMPIRICAL_ONLY",
      "unit": "proportion",
      "value": null,
      "owner": "field instrumentation and outcome custodian",
      "gate_id": "GATE-OUTCOME-LABELS-MATURITY-001",
      "proof_level": 0,
      "measurement": null,
      "authority_attestation": null,
      "sensitivity_set_ids": []
    },
    {